,count,title,poster,release_date,over_view
0,0,테드 래소,/t/p/w94_and_h141_bestv2/lKSNsuonUq57p7BkJAzoGpz5tl2.jpg,"8월 14, 2020","미국 미식축구 코치 테드 래소. 축구에 대해 아무것도 모르는 그는 영국 축구팀 코치로 발탁되며 런던으로 떠난다. 하지만 모든 것이 낯설기만 한데… 그는 긍정적인 에너지와 투지, 그리고 비스킷으로 자신을 부족함을 채워보려 한다. 골든 글로브 수상에 빛나는 제이슨 서디키스 주연의 코미디 시리즈."
1,1,리에종,/t/p/w94_and_h141_bestv2/keLn4FQGDKvtMZeORtrhBQpN5C5.jpg,"2월 24, 2023","애인 사이였던 두 요원이 힘을 합해 영국을 위협하는 국제적 사이버 공격에 맞서는 가운데, 묻어 두어야 했던 두 사람 사이의 비밀과도 마주하게 된다."
2,2,어둠의 나날,/t/p/w94_and_h141_bestv2/1kZdBrH1C07Zf2131QUpmju3kO6.jpg,"11월  1, 2019","먼 미래, 살아남은 인류는 시력을 잃었다. 그렇게 시력이 전설적인 능력으로 여겨지던 어느 날, 시력이 있는 쌍둥이가 태어난다.  바바 보스는 쌍둥이를 해치려는 위협적인 여왕으로부터 부족을 보호해야 한다."
3,3,에코 3: 스페셜 포스 유닛,/t/p/w94_and_h141_bestv2/8rENW21v9jZXHC7xNnNsqsXsqmL.jpg,"11월 22, 2022",훌륭한 과학자 앰버 체스버러가 콜롬비아와 베네수엘라 국경에서 사라지자 미 육군 특공대원들인 앰버의 남편과 오빠는 게릴라 전쟁에서 앰버를 찾기 위해 고군분투하는 도중에 그들이 사랑하는 여자에게 비밀이 있을지도 모른다는 사실을 알게 된다.
4,4,서번트,/t/p/w94_and_h141_bestv2/di8oOmHiD7WnqeagDU57oqaYmdx.jpg,"11월 28, 2019","슬픔에 빠진 한 필라델피아 부부의 이야기를 다루는 드라마. 입에 담지 못할 비극으로 인해 이들의 결혼 생활에 균열이 생기고, 불가사의한 힘이 집 안으로 들어오도록 문을 열게 된다. M. 나이트 샤말란 제작 참여."
5,5,포 올 맨카인드,/t/p/w94_and_h141_bestv2/izrGAVvWoLL5zjNfOpyD2feydx.jpg,"11월  1, 2019","2019년 11월 Apple TV+에서 방영을 시작한 SF물. 끝없이 경쟁하며 치열하게 우주 개발을 매진하는 세상. 그 속에서 우리는 어떤 모습으로 살아갈까. 유명한 소련 로켓 공학자 코롤료프 박사가 암 수술에 성공해 살아남았고, 미국의 케네디 대통령도 실패에서 나올 후폭풍을 두려워하며 달 탐사 계획에 적극적이지 않아 소련이 미국을 앞서서 최초로 달에 착륙한다. 소련의 잇따른 성공에 자극 받은 미국이 우주경쟁에 이기기 위해 적극적으로 우주 프로그램에 투자하고, 달에서 얼음이 발견 되면서 달에 우주 기지를 세울수 있게 되어 실제 역사보다 수십년치 이상 우주기술이 발전하게 된다. NASA 우주 비행사들과 가족의 위태로운 삶을 조명하며 매혹적인 만약의 역사 속으로 빠져보자."
6,6,인베이션,/t/p/w94_and_h141_bestv2/7rpiHZx10Nm50AtzTUEO9eyaKdq.jpg,"10월 21, 2021",갑작스런 외계인의 침공으로 생존을 위협받는 인류. 일상은 사라졌고 세상은 혼란에 빠졌다. 각자가 처한 믿을 수 없는 현실을 극복하려는 다섯 명의 평범한 사람들. 시시각각 발생하는 위기 상황에 대처할 수 있을까?
7,7,트루스 비 톨드,/t/p/w94_and_h141_bestv2/zBc5nqwYy9cwJGoA16Sc4jmgyuP.jpg,"12월  6, 2019",범죄 팟캐스트의 세계로. 옥타비아 스펜서가 위험을 무릅쓰고 진실과 정의를 좇는 팟캐스터 포피 파넬 역을 맡아 열연을 펼친다. NAACP 이미지 어워드 수상작.
8,8,블랙 버드,/t/p/w94_and_h141_bestv2/79M2yNSmkh4CCMrWNV6b2xvIeNn.jpg,"7월  7, 2022",10년의 형기를 시작한 지미 킨은 놀라운 제안을 받는다. 살인 혐의를 받은 래리 홀에게서 자백을 받아 낼 수 있다면 지미는 자유의 몸이 된다. 이 임무 완수는 생애 최고의 도전이 된다.
9,9,아카풀코,/t/p/w94_and_h141_bestv2/gzBkO4zFr75A13GKnjvTeg25pze.jpg,"10월  8, 2021","1984년 어느 날, 막시모 가야르도는 아카풀코에서 가장 핫한 리조트 라스 콜리나스에 취직하며 마침내 꿈꿔 왔던 일을 이룬다. 하지만 일생일대의 기회를 잡은 기쁨도 잠시, 출근하고 보니 결코 쉬운 일이 아님을 깨닫는데..."
10,10,선사시대: 공룡이 지배하던 지구,/t/p/w94_and_h141_bestv2/yMdFsHKp4YX2CUkAQcZswxXDuoe.jpg,"5월 23, 2022","2022년 5월 Apple TV+에서 방영을 시작한 다큐멘터리. 현생 조류를 제외한 공룡들이 마지막으로 번성한 시기인 마스트리히트절 내에서 K-Pg 멸종이 일어나기 이전의 지구를 배경으로 백악기 말에 살았던 공룡들의 삶을 CG를 통해 재현함으로써 웅장한 공룡과 특별한 생물들이 땅과 바다, 하늘을 누볐던 6,600만 년 전으로 거슬러 올라가며 전례 없는 경이로움을 선사한다."
11,11,세브란스: 단절,/t/p/w94_and_h141_bestv2/dI0ZQxmpEaUILPX2kxjDGm3V6DF.jpg,"2월 17, 2022",마크는 시술로 직장 생활과 사생활의 기억이 나뉜 사람들로 이루어진 부서의 팀장이다. 회사 밖에서 의문에 싸인 동료가 나타나면서 그들의 일에 대한 진실을 밝히는 여정이 시작된다.
12,12,맵다 매워! 지미의 상담소,/t/p/w94_and_h141_bestv2/jFUZebOjrjZfvg7ZSrc19GvTRTg.jpg,"1월 26, 2023","아빠이자 친구, 그리고 심리 치료사인 지미는 아내를 잃고 힘들어하면서 만나는 사람들에게 잔인할 만큼, 어떤 것도 거르지 않고 정직하게 다가가 보기로 한다. 과연 지미는 다른 사람을 도우면서 자신을 도울 수 있을까? 다시 삶의 희망을 찾을 수 있을까?"
13,13,파운데이션,/t/p/w94_and_h141_bestv2/A1fXGFxDifQzj08OlaGTVcnXHyd.jpg,"9월 23, 2021","아이작 아시모프의 소설 원작. 은하 제국의 멸망이 다가오자, 인류를 구하고 문명을 재건하기 위해 나선 망명자들의 장대한 여정을 그린다."
14,14,슬로 호시스,/t/p/w94_and_h141_bestv2/8FM8KCgZQSbLLXcZew0MSj6so1k.jpg,"3월 31, 2022","영국 정보기관 MI5의 낙오자들이 모인 곳, 슬라우 하우스. 스파이 경력에 치명적인 실수를 저질러 이곳에 오게 된 무능력한 MI5 요원들로 구성된 팀과 이들을 이끄는 똑똑하지만 다혈질인 리더 잭슨 램이 사악한 세력으로부터 영국을 지키기 위해 첩보 세계의 연막과 은폐를 파헤치는 과정을 보여 준다."
15,15,디킨슨,/t/p/w94_and_h141_bestv2/dDdcAfHBZ6Aalv53iR6o35CSLWA.jpg,"11월  1, 2019","헤일리 스타인펠드가 에밀리 디킨슨 역으로 출연한다. 시인, 딸, 완벽한 반항아. 세계 최고의 시인으로 꼽히는 에밀리 디킨슨의 성장 이야기를 그려낸다."
16,16,더 스누피 쇼,/t/p/w94_and_h141_bestv2/6YDIVkXWpyeBhudI6NBckrVffR2.jpg,"2월  5, 2021","세상에서 가장 유명한 비글 스누피가 찾아온다. 자유롭게 춤추고 날아다니며, 풍부한 상상력을 펼치는 스누피가 절친 우드스탁, 피너츠 친구들과 함께 새로운 모험을 시작한다"
17,17,미틱 퀘스트,/t/p/w94_and_h141_bestv2/80Y81wTZNOO6TvIdFmUqBhjhAq3.jpg,"2월  7, 2020","역대 최대의 멀티플레이어 비디오 게임 팀. 이들은 가상 세계를 창조하고, 영웅을 키우고, 전설을 만들어 낸다. 하지만 때때로, 가장 치열한 전쟁은 게임 속이 아니라 사무실에서 벌어진다"
18,18,샨타람,/t/p/w94_and_h141_bestv2/ti08KfQbBf0BfQP86ymJ8YxCSVA.jpg,"10월 14, 2022","탈주범 린 포드는 흔적도 없이 사라지려고 1980년대 번잡한 봄베이 거리로 뛰어든다. 봄베이의 가난하고 버림받은 사람들을 위해 구급대원 노릇을 하던 린은 자신의 죄를 갚기 위한 기나긴 여정에서 예상도 못 했던 사랑과 유대감, 그리고 용기를 발견하게 된다."
19,19,끝까지! 바모스 레알 마드리드!,/t/p/w94_and_h141_bestv2/tXkn620YpI0b9HTBziMlsBKL3B7.jpg,"3월  9, 2023",놀라울 정도로 훌륭한 2021-2022시즌을 보낸 대표적인 축구팀과 동행하며 그들의 경기와 드러나지 않은 뒷이야기를 함께하는 여정. 팬들의 열광적인 응원에 힘입어 모든 예상을 깨고 그들을 믿지 않은 모든 사람을 잠재우는 모습을 담는다.
20,20,헬로 투모로우!,/t/p/w94_and_h141_bestv2/2x9KMUf6uCt3gKlzQw3es6x3zv1.jpg,"2월 16, 2023",복고풍 미래 세계의 카리스마 넘치는 영업 사원 잭 빌링스(빌리 크루덥)는 영업 팀을 이끌며 달 위의 여가용 주택으로 고객들의 삶에 새로운 활력을 불어넣어 주기로 한다.
21,21,더 모닝 쇼,/t/p/w94_and_h141_bestv2/jKjbVTNKXrC2yFdy1xQxpPOiXjI.jpg,"11월  1, 2019",2021년 9월 Apple TV+에서 방영을 시작한 드라마. 미국의 아침을 깨우는 더 모닝 쇼의 호스트인 미치 케슬러의 섹스 스캔들이 폭로되면서 방송국은 엄청난 타격을 입게 된다. 미치와 함께 진행을 하던 알렉스 레비는 오랜 기간 동안 진행해 온 프로그램이 존폐 위기에 놓이자 어떻게 해서든 쇼를 지키려고한다. 그들이 직면한 새로운 방송국과 급변하는 세상은 정체성이 지배하는 곳이다. 겉으로 보이는 모습과 진정한 자아 사이의 격차가 새로운 갈등을 만드는데...
22,22,"재난, 그 이후",/t/p/w94_and_h141_bestv2/yLx44hdSpt9GhP67JafP5sMEoMB.jpg,"8월 11, 2022","허리케인 카트리나 당시, 실제 사건을 바탕으로 함. 홍수로 물이 차오르고, 전력이 끊기고, 열기가 치솟으며, 뉴올리언스 병원의 지친 직원들이 중대하고 가슴 아픈 결정을 해야 한다."
23,23,제이컵을 위하여,/t/p/w94_and_h141_bestv2/JTmkzwSDRiS9nvSPwpDB9fmZj2.jpg,"4월 24, 2020","충격적인 범죄가 매사추세츠주의 한 작은 마을, 그중에서도 특히 한 가족을 흔들어 놓는다. 아들이 같은 반 친구를 살해한 혐의로 기소되면서 한 가족의 삶이 걷잡을 수 없는 혼란에 빠진다. 지방 검사보는 정의를 수호하겠다는 서약과 아들에 대한 무조건적인 사랑 사이에서 하나를 선택해야만 한다."
24,24,우린폭망했다,/t/p/w94_and_h141_bestv2/ch28OlP49Hr2ftNGhftr3Mix1BU.jpg,"3월 18, 2022","실제 사건에서 영감을 받은 이야기, 그리고 그 모든 중심에는 사랑이 있다. '위워크'는 10년도 안 되어 단 하나의 공유 사무실에서 470억 달러 가치의 국제 브랜드로 성장했으나, 채 1년도 안 되어 400억 달러를 잃었다. 과연 무슨 일이 있었던 걸까?"
25,25,모스키토 코스트,/t/p/w94_and_h141_bestv2/aYHIhnTgAhCLk6y5iAjtloD0Nm.jpg,"4월 30, 2021","앨리 폭스는 명석한 두뇌를 지닌 발명가이자 완고한 이상주의자다. 미국 정부로부터 벗어나 안전한 보금자리를 찾기 위해, 그는 가족들과 함께 멕시코로 향하는 위험한 여정에 오른다"
26,26,디어 에드워드,/t/p/w94_and_h141_bestv2/iJ7yzFPuoD9pb8NeOm82NOV7SiJ.jpg,"2월  2, 2023","한 12세 소년이 비행기 추락 사고에서 유일하게 살아남는다. 그 비극의 영향을 받은 다른 사람들과 소년이 상황을 이해하려고 노력하면서 예상치 못했던 우정과 사랑, 공동체가 형성된다."
27,27,샤이닝 걸스,/t/p/w94_and_h141_bestv2/geATgY8IUec5z1JAvpkO6PECjU6.jpg,"4월 28, 2022","잔혹한 공격을 당한 후 끊임없이 뒤바뀌는 현실을 겪게 된 커비 마즈라치는, 최근의 살인 사건이 그녀의 폭행 사건과 연결되어 있음을 알게 된다. 커비는 무한히 변화하는 현재를 이해하고 그녀의 과거를 마주하기 위해, 베테랑 기자인 댄 벨라스케스와 힘을 합친다."
28,28,파친코,/t/p/w94_and_h141_bestv2/4PSmsKZ1yeJB612dSxgJRROFPHP.jpg,"3월 25, 2022","2022년 3월 Apple TV+에서 방영을 시작한 드라마. 이민진의 동명의 소설을 원작으로 한다. 일제강점기 이후 부산 영도에서 오사카로 건너간 한국인 이민자인 선자의 4대에 걸친, 고국을 떠나 억척스럽게 생존과 번영을 추구하는 한인 이민 가족의 꿈과 희망을 기록한다. 금지된 사랑에서 시작되는 이야기는 한국과 일본, 그리고 미국을 오가며 전쟁과 전쟁과 평화, 사랑과 이별, 승리와 심판에 대한 잊을 수 없는 연대기를 그린다."
29,29,어메이징 스토리,/t/p/w94_and_h141_bestv2/evcvXE6BP8fT8UoWsyiTBvxqyrL.jpg,"3월  6, 2020","스티븐 스필버그와 에드워드 킷시스, 애덤 호로위츠가 제작 총괄을 맡아 재구성한 고전 시리즈. 평범한 일상 속 인물들을 놀라운 상상력과 가능성이 펼쳐지는 세계로 이끈다."
30,30,밤이 되기 전에,/t/p/w94_and_h141_bestv2/hwXyeCVBCnP8jBG4SjVTkmuMvHG.jpg,"4월  3, 2020",가족과 함께 아버지의 고향 마을로 이주하게 된 소녀 기자 힐데 리스코. 그곳에서 마주하게 된 사건의 진실을 쫓던 힐데는 마을의 충격적인 비밀을 밝혀내기 시작한다
31,31,2050: 벼랑 끝 인류,/t/p/w94_and_h141_bestv2/zTe1NurXWETsREUCMPFy7sJACUQ.jpg,"3월 16, 2023","33년에 걸친 8개의 연작을 통해 지구의 기후 변화가 가족, 일, 신앙, 생존에 어떤 영향을 미칠지 탐구한다."
32,32,Dr. 브레인,/t/p/w94_and_h141_bestv2/nxfyXDghW2SbQbwRen6uh12OzXV.jpg,"11월  3, 2021","김지운 감독의 첫 번째 시리즈. 천재 뇌과학자 세원은 가족에게 일어난 비극으로 인해 고통받고 있다. 사건의 진실을 밝히기 위해, 그는 죽은 자의 뇌에 접속해서 그들의 기억 속 단서를 찾아 나선다"
33,33,센트럴 파크,/t/p/w94_and_h141_bestv2/myGH5W6UD5sGNBFOLVjDH9ilenF.jpg,"5월 29, 2020",뉴욕 센트럴 파크에서 사는 오언 틸러먼 가족의 독특한 일상을 담아낸 코미디 뮤지컬 애니메이션. 그들은 공원을 콘도로 바꾸려 하는 호텔 상속녀를 막아야 한다.
34,34,고스트라이터,/t/p/w94_and_h141_bestv2/aekPKOzUhaOFrUrgFE31AekVg28.jpg,"11월  1, 2019",동네 서점에 유령이 나타나 소설 속 등장인물들을 현실 세계에 내보내기 시작한다. 네 명의 아이들이 힘을 합쳐 유령을 둘러싼 흥미진진한 수수께끼를 풀어야만 한다
35,35,트라잉,/t/p/w94_and_h141_bestv2/zZH9gyfCf33IBB1La8sDmteAxQN.jpg,"5월  1, 2020","니키와 제이슨은 아이를 원하지만, 뜻대로 되지 않는다. 그러나 아이 없이 50년 여생을 어떻게 보낼까? 두 사람은 모든 선택지를 곱씹어 본 후 아이를 입양하기로 결심하지만, 입양 과정은 또 그것대로 시련의 연속이다. 친구들은 어딘가 나사가 하나씩 빠진 것 같고, 가족은 엉뚱하고, 삶은 혼돈 그 자체인데, 과연 입양 위원회는 그들이 아이의 부모가 되는 것에 동의할 것인가?"
36,36,지하창고 사일로의 비밀,/t/p/w94_and_h141_bestv2/aD1ITkqEWR7VtgkLPfZaQ16FCgL.jpg,"5월  4, 2023","황폐해지고 유독한 물질로 가득한 미래, 수백 층 깊이의 지하 깊숙한 곳 거대한 저장고에 존재하는 공동체가 있고, 자기들을 지켜 준다고 믿는 규칙으로 가득한 그 사회에서 사는 남자들과 여자들이 있다."
37,37,피지컬,/t/p/w94_and_h141_bestv2/f9NDJfoIXZ7Db7SSZyNBVGf8fie.jpg,"6월 18, 2021","1980년대, 캘리포니아의 한 주부인 실라 루빈은 내면의 부정적인 목소리와 싸우며 남몰래 고통받고 있다. 그러던 어느 날 그녀는 에어로빅을 접하는데… 성공을 향한 여정에 나서며 루빈의 삶은 변화하기 시작한다"
38,38,용의자들,/t/p/w94_and_h141_bestv2/muLbLW8kWOSiEBLgmHeAw6gKpB0.jpg,"2월  4, 2022","4명의 평범한 영국인이 미국의 저명한 언론계 거물의 아들을 납치했다는 혐의를 받는다. 이들은 시간과 싸우며 자신들의 결백을 밝히는 절박한 경주를 시작하지만, 누가 그들을 믿을 것이며, 또한 과연 그들은 진실을 말하고 있을까?"
39,39,배드 시스터즈,/t/p/w94_and_h141_bestv2/tNer6gprt5gFGJzjar2NUHP2sn.jpg,"8월 19, 2022",친밀한 관계의 가비 자매들은 늘 서로를 보살펴 왔다. 자매들의 형부가 죽자 형부의 생명 보험 회사는 악의에 의한 살인임을 입증하기 위한 수사를 시작하고 살인 동기가 충분한 자매들에게 집중한다.
40,40,애프터파티,/t/p/w94_and_h141_bestv2/yNL5TIh8e9NXm1WK2BYY7TcIvvz.jpg,"1월 28, 2022","고등학교 동창회의 뒤풀이가 충격적인 죽음으로 끝나고, 모두가 용의자가 된다. 형사는 옛 반 친구들을 한 명씩 조사해 살인 동기를 밝혀내려고 하고, 그들은 자신들의 관점에서 그날 밤 일을 얘기한다. 그리고 결국, 놀라운 진실이 드러난다."
41,41,슈미가둔!,/t/p/w94_and_h141_bestv2/s2Z5Rm7H0DFHX8cF0CQjIFOd6Am.jpg,"7월 16, 2021",1940년대 뮤지컬을 패러디한 코미디. 함께 배낭여행을 떠난 멀리사와 조시 커플은 춤과 노래로 가득한 신비로운 마을 슈미가둔에 갇히게 된다. 진정한 사랑을 찾기 전까지는 떠날 수 없다는 이곳. 이미 자격이 된다고 생각했던 두 사람은 어쩐지 미궁 속을 헤맨다
42,42,존 스튜어트의 이슈,/t/p/w94_and_h141_bestv2/bSoMxBoLshQ1l490cpaMY1tREPR.jpg,"9월 30, 2021","세상에 만연한 문제를 살피다 보면 그 막막함에 그저 압도되어 버리기 쉽다. 대체 어디서부터 잘못된 건지, 원인을 정확히 집어내기란 더 어려운 일이다. 존 스튜어트는 특정 문제로 인해 영향을 받은 사람들을 만나 변화를 일으킬 수 있는 방법에 대해 논한다"
43,43,로어: 세상을 향한 함성,/t/p/w94_and_h141_bestv2/bCpeyWbqzrWudMdqcsy9Hf1JcUW.jpg,"4월 15, 2022","화려한 출연진과 다양한 장르를 아우르는 이 문집 시리즈는 성 역할, 자율성, 정체성과 같은 주제를 새로운 시각으로 다룬 8편의 블랙 코미디 페미니스트 이야기로 엮여 있다."
44,44,"세모, 네모, 동그라미 모양 친구들",/t/p/w94_and_h141_bestv2/jjKXdP3ZgueaP1sut08GXIPqqCu.jpg,"1월 19, 2023","한 예쁜 섬에서 네모와 세모, 동그라미는 서로의 차이점을 극복하는 법을 배우며 모험과 공감대를 찾는다. 맥 바넷과 존 클라센의 국제 베스트셀러 동화책들을 기반으로 한다."
45,45,의사 그리고 나,/t/p/w94_and_h141_bestv2/6GntfIwANAouXvb2msnoKytwYbv.jpg,"11월 11, 2021",그저 조금 더 나은 삶을 살고 싶었던 것뿐인데. 도움을 받고자 찾아갔던 정신과 의사에게서 오히려 삶을 송두리째 빼앗겨 버린 마티. 30여 년 동안 자신의 인생을 잠식하고 파괴한 주치의의 악행을 깨닫는다. 실화를 바탕으로 긴장감 넘치는 심리 묘사를 그려냈다.
46,46,스웨거,/t/p/w94_and_h141_bestv2/uQUcWDagMCI8m96rko8zMK7SpHF.jpg,"10월 29, 2021",어려움을 극복하고 진정으로 당당해지기 위해 압박감의 늪을 헤쳐 나가야 하는 어느 농구 신동의 이야기
47,47,친애하는...,/t/p/w94_and_h141_bestv2/myMNJt2UeW1NuhUlpOXhOURO4sU.jpg,"6월  5, 2020",한 사람의 이야기가 세상을 바꾸기도 한다. 각 분야를 대표하는 인물들의 영향력은 세계 곳곳에 많은 사람들의 삶에 영감을 준다
48,48,작은 세상,/t/p/w94_and_h141_bestv2/5W3JUWqR9UdN5FTvhE3PAbWqG63.jpg,"10월  2, 2020",자연의 가장 작은 생명체들을 포착한 다큐멘터리 시리즈. 각 에피소드는 세상에 잘 알려지지 않은 작은 생명체들의 독특한 생존법과 경이로운 이야기를 생생하게 조명한다. 폴 러드 내레이션
49,49,리시 이야기,/t/p/w94_and_h141_bestv2/ge0Lk0fDBoFNGdtBXnIEaonyfTW.jpg,"6월  4, 2021",스티븐 킹의 소설을 원작으로 한 이 무서운 스릴러는 작가 스콧 랜던과의 결혼과 그를 괴롭혔던 어둠에 대한 기억을 되살리는 일련의 불온한 사건들로 미망인 리세이 랜던의 뒤를 잇는다.
50,50,우먼 인 더 워터,/t/p/w94_and_h141_bestv2/4Fsz8eeruaAZtqWWl3ldIiKq9tp.jpg,"7월 28, 2022","심각한 두부 손상을 입고 극심한 기억 상실로 고생하는 소피는 남편과 친구들의 도움으로 자신의 삶을 되찾는 여정에 나서지만, 흠잡을 데 없이 완벽한 삶이 과연 진실인지 의문을 품기 시작한다."
51,51,우주로 간 스누피,/t/p/w94_and_h141_bestv2/5ANLOZ6b8HfW5ytzeLPUR6Kc6VA.jpg,"11월  1, 2019",NASA 우주 비행사가 되는 꿈을 이루며 커다란 모험을 시작하는 스누피. 찰리 브라운과 친구들의 도움으로 스누피는 국제 우주 정거장에 도착해 임무를 수행하며 달과 우주를 탐험한다
52,52,카풀 노래방: 시리즈,/t/p/w94_and_h141_bestv2/bA6tpDMoyQO8fRmXC8sHh7LQoqW.jpg,"8월  8, 2017",정보 없음
53,53,콜,/t/p/w94_and_h141_bestv2/lzb4SwMTwNZPaifi0qDc9U0imzG.jpg,"3월 19, 2021",전화기 너머 낯선 이들의 목소리가 들려온다. 전화상의 대화로 전개되는 획기적인 연출의 시리즈. 통화 속 주인공들은 세상을 덮친 기괴한 사건들로 인해 걷잡을 수 없는 혼돈에 빠진다
54,54,톨레미 그레이의 마지막 날들,/t/p/w94_and_h141_bestv2/j68fEr92ZsRqvq1J7806bAf4poD.jpg,"3월 11, 2022","자신을 돌봐 주던 믿음직한 사람이 갑자기 떠나고, 톨레미 그레이는 십 대 고아인 로빈에게 맡겨진다. 그들은 톨레미의 치매를 치료하고 기억을 되찾아 줄 치료에 관해 알게 되고, 놀라운 진실을 찾는 여정을 시작한다."
55,55,디 에식스 서펀트,/t/p/w94_and_h141_bestv2/lSVygN5ZLmSMycBTe94umdKfTSd.jpg,"5월 13, 2022","런던에 사는 과부, 코라 시본이 신화 속 뱀에 관한 보고를 조사하기 위해 에식스로 떠난다. 코라는 마을 신부와 예기치 않게 유대 관계를 맺지만, 참사가 일어나자, 주민들은 코라가 뱀을 이끌었다고 의심한다. 세라 페리 소설 원작."
56,56,고요한 물,/t/p/w94_and_h141_bestv2/hFvYDuR1lzm8HFMb12NWZ1ZvPEU.jpg,"12월  4, 2020","세 남매 칼, 애디, 마이클의 옆집에는 아주 특별한 이웃이 살고 있다. 바로 지혜로운 판다, 고요한물이다. 고요한물이 우리의 세상과 삶을 새롭게 바라보게 하는 다양한 이야기를 들려준다"
57,57,리틀 보이스,/t/p/w94_and_h141_bestv2/vxzWAyNw7T7r7a6aQdPe2bahMPh.jpg,"7월 10, 2020","뉴욕에서 뮤지션으로서의 꿈을 이루고 싶은 베스 킹. 거듭되는 실패, 연애와 가족 문제에 직면하지만, 끝끝내 꿈을 향해 용기 있게 한 걸음씩 나아간다."
58,58,미스터 코먼,/t/p/w94_and_h141_bestv2/54BAbjnTRUsxqyE8F8exjJ8nwpo.jpg,"8월  6, 2021","행운이 따랐더라면, 다른 선택을 했더라면, 조시 코먼은 성공한 록스타의 삶을 살았을지도 모른다. 현재 그는 아이들을 가르치는 초등학교 교사가 되었고 학생들을 아끼는 마음은 분명하지만, 여전히 행복과 삶의 의미를 찾기 위해 고민한다"
59,59,그가 나에게 말하지 않은 것,/t/p/w94_and_h141_bestv2/8b5re8SfAMQkDPHl8W6hrUJk9OT.jpg,"4월 13, 2023",한 여자가 불가사의하게 실종된 남편을 찾기 위해 십 대 의붓딸과 돈독한 관계를 형성해야 한다.
60,60,소녀 탐정 해리엇,/t/p/w94_and_h141_bestv2/wa1rgNy8HJueMDTvJ6CkfyHlv5P.jpg,"11월 18, 2021","거침없고 끊임없는 호기심 덩어리. 그게 바로 11살의 해리엇이다. 하지만 미래의 작가, 해리엇 M. 웰시가 되려면 모든 것을 알아야 하고 그러려면 모두를 철저히 지켜봐야 한다"
61,61,돈벼락,/t/p/w94_and_h141_bestv2/jf9EyK7KgHIAzpOEVujAFScUkcW.jpg,"6월 23, 2022","결혼 20년 후, 남편과 이혼하며 받은 합의금 870억 달러로 뭘 할지 결정해야 하는 몰리 노백은 자신의 자선 단체 일에 다시 집중하며 진짜 세상으로 나아가기로 하고, 그렇게 자신을 찾아가는 몰리 노백의 성장기."
62,62,자연에 깃든 밤의 색깔,/t/p/w94_and_h141_bestv2/lZSsVWbsf1ECPZfENCwmitZJmJU.jpg,"12월  4, 2020",동물들의 어둠 속 생활을 최첨단 카메라 기술로 생생하게 포착한 다큐멘터리 시리즈. 이제껏 보지 못한 동물들의 신비로운 밤의 세계가 펼쳐진다. 톰 히들스턴이 영어 내레이션을 맡았다
63,63,리틀 아메리카,/t/p/w94_and_h141_bestv2/8lAMdxL8uirqyavsD6H3QGQmTkA.jpg,"1월 17, 2020",'빅 식'과 '마스터 오브 제로'의 제작진이 만든 시리즈. 미국 이민자들의 이야기 속에 재미와 감동을 담았다.
64,64,프레즐 가족,/t/p/w94_and_h141_bestv2/7LVYadJOXPpbYzXNKUMIfzNZDsn.jpg,"2월 11, 2022","한창 뛰어놀고 싶어 하는 다섯 마리의 강아지를 뒤에서 받쳐주는 세계에서 가장 긴 닥스훈트이자 장난기 많은 아빠 프레첼을 만나보세요. 아내 그레타와 함께, 그들은 강아지들이 문제를 해결하기 위해 발을 들고 세상에 '목소리를 높일' 수 있도록 격려합니다."
65,65,오리와 거위,/t/p/w94_and_h141_bestv2/r8hYMspbGJd2RPfop3VHAwQjk6x.jpg,"7월  7, 2022","두 깃털 친구 오리랑 거위는 서로 많이 다르지만, 이 유아용 프로그램에서 두 친구는 서로의 가장 큰 장점을 끌어내는 방법을 배운다. 태드 힐스의 동화책이 원작."
66,66,롱 웨이 업,/t/p/w94_and_h141_bestv2/54abZr85RxwJxutOfKMaFwZ7xfh.jpg,"9월 18, 2020",이완 맥그리거와 찰리 부어먼이 함께한 세 번째 모터사이클 여정. 이번 시리즈를 위해 특별 제작된 할리데이비슨 전기 바이크를 타고 남미에서 중미를 횡단한다
